issue,description,value,effort,type,blockedBy,done,critical,milestone
579,City objects are forgotten on death,13,3,Bug,,,,
580,"Damage shield on block, not hit",1,5,Feature,,,,
581,Don't damage armour on block,1,5,Feature,,,,
582,Don't damage weapon or armour on miss/dodge,1,5,Feature,,,,
584,Can gather from a fig tree briefly before it changes type and is empty,5,8,Bug,,,,
585,Make ranged weapons viable at high latency,21,13,Usability,,,TRUE,3 Tin wrapup
586,Construction sites have windows despite no permission,3,2,Bug,,,,
590,"Players can get stuck inside objects, and respawn on restarting client",34,13,Bug,,,,
593,Friends list,13,21,Feature,,,,
594,"Show enemy objects as red, not yellow",8,3,Bug,,,,
595,Prevent declarations of war against nonexistent entities,8,5,Bug,,,,
597,Make tutorial cyclopes all objects,5,3,Code quality,,,,
603,Pet breeding,2,21,Feature,597,,,
604,Pets can be set to aggressive or defensive,2,8,Feature,597,,,
605,Pets can be ordered to follow or stay,3,8,Feature,609,,,
606,Pets consume food automatically,3,8,Feature,378,,,
607,Starved pets become mobs,1,13,Feature,606,,,
608,Allow pets to ride on some vehicles,5,13,Feature,609,,,
610,Pets shouldn't count towards their original spawner's limit,2,5,Exploit,,,,
612,Remove player XP/levels,13,13,Feature,,,TRUE,
613,Show gear on humanoid corpses,3,8,Feature,,,,
